<?xml version="1.0" encoding="UTF-8"?>
<root xmlns:xsi="http://www.w3.org/2001/XMLSchema-instance"
  xsi:noNamespaceSchemaLocation="../../../assets/schemas/interpretation.xsd">
  <attr name="caption" value="co01">
    <interpretation use="css">
      <style>
        <key>background-color</key>
        <value>green</value>
      </style>
      <style>
        <key>color</key>
        <value>black</value>
      </style>
    </interpretation>
  </attr>
  <attr name="caption" value="co02">
    <interpretation use="css">
      <style>
        <key>background-color</key>
        <value>amber</value>
      </style>
      <style>
        <key>color</key>
        <value>black</value>
      </style>
    </interpretation>
  </attr>
  <attr name="caption" value="co03">
    <interpretation use="css">
      <style>
        <key>background-color</key>
        <value>yellow</value>
      </style>
      <style>
        <key>color</key>
        <value>black</value>
      </style>
    </interpretation>
  </attr>
  <attr name="caption" value="co04">
    <interpretation use="css">
      <style>
        <key>background-color</key>
        <value>red</value>
      </style>
      <style>
        <key>color</key>
        <value>black</value>
      </style>
    </interpretation>
  </attr>
  <attr name="caption" value="co07">
    <interpretation use="css">
      <style>
        <key>background-color</key>
        <value>white</value>
      </style>
      <style>
        <key>color</key>
        <value>black</value>
      </style>
    </interpretation>
  </attr>
  <attr name="caption" value="co08">
    <interpretation use="css">
      <style>
        <key>background-color</key>
        <value>grey</value>
      </style>
      <style>
        <key>color</key>
        <value>black</value>
      </style>
    </interpretation>
  </attr>
  <attr name="caption" value="co62">
    <interpretation use="css">
      <style>
        <key>background-color</key>
        <value>yellow</value>
      </style>
      <style>
        <key>color</key>
        <value>white</value>
      </style>
    </interpretation>
  </attr>
  <attr name="caption" value="co66">
    <interpretation use="css">
      <style>
        <key>background-color</key>
        <value>red</value>
      </style>
      <style>
        <key>color</key>
        <value>black</value>
      </style>
    </interpretation>
  </attr>
  <attr name="caption" value="co67">
    <interpretation use="css">
      <style>
        <key>background-color</key>
        <value>red</value>
      </style>
      <style>
        <key>color</key>
        <value>white</value>
      </style>
    </interpretation>
  </attr>
  <attr name="caption" value="co81">
    <interpretation use="css">
      <style>
        <key>background-color</key>
        <value>black</value>
      </style>
      <style>
        <key>color</key>
        <value>yellow</value>
      </style>
    </interpretation>
  </attr>
  <attr name="caption" value="co82">
    <interpretation use="css">
      <style>
        <key>background-color</key>
        <value>black</value>
      </style>
      <style>
        <key>color</key>
        <value>white</value>
      </style>
    </interpretation>
  </attr>
  <attr name="caption" value="co83">
    <interpretation use="css">
      <style>
        <key>background-color</key>
        <value>black</value>
      </style>
      <style>
        <key>color</key>
        <value>red</value>
      </style>
    </interpretation>
  </attr>
  <attr name="caption" value="co84">
    <interpretation use="css">
      <style>
        <key>background-color</key>
        <value>black</value>
      </style>
      <style>
        <key>color</key>
        <value>green</value>
      </style>
    </interpretation>
  </attr>
  <attr name="caption" value="co85">
    <interpretation use="css">
      <style>
        <key>background-color</key>
        <value>black</value>
      </style>
      <style>
        <key>color</key>
        <value>amber</value>
      </style>
    </interpretation>
  </attr>
</root>